topic,title,problem,target,data,policy_impact,competition_score,recommendation
청년 1인가구 고립 문제,고립 위험 지수 개발 및 복지 사각지대 지도화,고립·은둔 청년은 복지 시스템에 포착되지 않아 지역별 위험도 수치화로 선제 개입이 필요하다,복지 정책 담당자 / 지자체,주민등록인구통계; 청년 1인가구 현황; 복지서비스 이용 현황; 고독사 발생 현황; 정신건강복지센터 통계,높음,매우 높음,YES
청년 1인가구 고립 문제,간접 생활 지표 기반 고립 청년 조기 탐지 모델,신청 기반 복지에서 누락되는 고립 청년을 건강보험 체납·의료 미이용 등 간접 지표로 탐지한다,지자체 복지팀 / 국민건강보험공단,건강보험료 체납 현황; 응급실 내원 현황; 전기·가스 복지 할인 데이터; 복지 상담 이력; 청년 고용·실업 통계,높음,높음,NO
청년 1인가구 고립 문제,청년 커뮤니티 인프라 접근성과 고립도 상관관계 분석,청년 커뮤니티 공간의 고립 완화 효과를 데이터로 검증해 인프라 투자 우선순위를 제시한다,문화체육관광부 / 지자체 청년정책과,청년공간·청년센터 현황; 공공도서관 이용 통계; 사회적 자본 조사; 정신건강 위기 상담 통계; 대중교통 접근성 데이터,중간,중간,NO
청년 1인가구 고립 문제,고독사 선행 지표 역추적 분석 및 예방 정책 제안,고독사 케이스 역추적으로 12~24개월 전 공통 선행 지표를 도출해 예방 개입 시점을 구체화한다,보건복지부 / 고독사 예방 정책 입안자,고독사 발생 현황; 1인가구 생활실태 조사; 실업급여 수급 이력; 정신건강 위기 개입 이력; 주거 취약 계층 현황,매우 높음,높음,NO
청년 1인가구 고립 문제,고립 위험 청년을 위한 공유주거·거점공간 입지 최적화,고립 위험 데이터와 공간 분석을 결합해 공유주거·거점공간 신규 시설의 최적 입지를 도출한다,LH 한국토지주택공사 / 지자체 주거정책과,공공임대주택·청년 매입임대 현황; 청년 1인가구 분포; 부동산 실거래가; 대중교통 노선; 청년 고립 상담 건수,중간,중간,NO
